Codigo;Protocolo
psz gth kpc enb 624557 448562;00000
eex zrf gsp eLr 864684 772222;00001
nat meb bgc Lmk 422342 433658;00002
JdJ etz zdf sLs 288455 838282;00003
tgg csz JLk Lfg 628883 236662;00004
sgh hrk aLd xpJ 843645 587867;00005
sgz xzg gxJ xbx 548632 534736;00006
fze bdc afr zet 427572 255473;00007
dss cJd nkx crx 762726 574645;00008
Jag tfz sbx hng 875678 668338;00009
fnL nbg tcn hJd 664834 746246;00010
mtn tdh zea cpt 745467 473582;00011
nrn kkm zsp Lkx 687487 358678;00012
kta gsb aps zgm 522628 847634;00013
pbm bfL bbJ teL 673573 365622;00014
bga hJf ang fhe 252876 764824;00015
npm Lzs sfz ses 365886 523574;00016
mfx nzf cgr hLL 844338 278462;00017
bss sfr fak Jes 843372 477786;00018
JxJ gnL msa fbr 374726 775537;00019
xxJ Jfs kme brc 733577 573626;00020
dsJ beg zfc dnp 833488 743436;00021
zxd nfx rkt Jaf 755235 347547;00022
zez rrb ddt Jcd 522527 848226;00023
rLL gcp hzr Jzm 384638 565478;00024
hJt hsn hLf Jxf 786268 338543;00025
czg mta szk edc 348242 642638;00026
sLt fLh shm apz 858858 766426;00027
rpJ ksf fxz kec 845885 366435;00028
sga ekz Jgd xpz 367764 734885;00029
sem szk Jzp kab 656768 445625;00030
ktp bfr aLn cLb 834785 683228;00031
fhe aLf Lat rxe 264578 825445;00032
tns rsd znr gsa 547857 442633;00033
xsa deb acp tks 488527 877827;00034
cdm kJd xen hpJ 882433 476284;00035
prx kJg JhJ trk 637835 632257;00036
knk xLn sbh ttL 644262 242458;00037
gre dke rfe dJb 383242 535282;00038
bha kdt mbr tft 563367 334846;00039
zgk ghJ zse Lmd 556585 725247;00040
dtd tge ggz hze 267237 743248;00041
ksf rac kxp Jng 754364 355276;00042
LhL bhc mha Jxa 452864 456744;00043
skk nJs gJd ech 282888 667257;00044
rgk czh Lce JJa 775828 738487;00045
pLx rpk Lxz zkh 337858 334733;00046
gsp rfm cbr bLm 553823 357252;00047
esn kpd sLa eda 244875 234268;00048
rsk rzx pnd sxm 324475 666456;00049
Lgh ftm faf cmJ 283688 648855;00050
xLg ett tde ptc 323747 468643;00051
bJx bnd ghJ fbp 234683 457432;00052
aJk anf hgf mmr 455475 765588;00053
htr cne nth kbJ 575333 848534;00054
ccd nrf hdn ecz 347652 673667;00055
npt aLf xfd bck 245347 243673;00056
fdh bJf mra rcr 622847 736375;00057
eme dam mze egk 446682 856767;00058
dbg Ltf ntb dea 237874 438625;00059
xfk zma txp pae 482765 328326;00060
LnJ Laz ees ebt 626426 832748;00061
mzJ bxn nre gdf 524253 535556;00062
Jbr fhc tLs exs 867362 652743;00063
zhz egJ gJp tzh 845428 543437;00064
bad pmt gpm Jxf 325852 223644;00065
LJz Lfe cnd hxg 288742 553278;00066
fks xkt dkJ LrJ 282627 876558;00067
teJ bzJ xhd xzn 575243 347765;00068
dcx rha Jce car 777653 663862;00069
php ahJ tfa rmr 677242 427358;00070
dtm frh fpn nkm 477622 433327;00071
Jdt cae htd beJ 878746 463753;00072
ddL fbr Jnh rpm 463658 355348;00073
dbh Jae fga fcc 642665 776653;00074
xkh zcz hsb Lhx 633873 258757;00075
tkk hnd cLz kex 668332 258878;00076
edk Jbn sLk nhg 325274 847752;00077
hmc bnp nkg gsz 743738 834373;00078
gdn cxg rkf LaL 623427 222755;00079
fbn hxe epa zLh 683842 753262;00080
nLc kJn esn gck 755622 476638;00081
spd bLL eef nkn 252456 488428;00082
pkt ghe tma psp 636686 346487;00083
ahz pzh reg cdx 342664 543684;00084
def Lxf frz fcm 726855 777557;00085
Lck gcJ hst Jfp 434442 575667;00086
shL fhc ezg zpc 546376 262364;00087
asa cbc axh pcn 786544 872343;00088
mLn tec fct Lhe 487562 822332;00089
zcp zdt epJ gcx 445764 737863;00090
fbd JLL Lrh bJd 223637 648662;00091
rpz mtd hfL fmm 442468 454475;00092
ftz Leb ksg dbr 338242 353776;00093
kLJ gLz hnk sdJ 856252 857323;00094
bbh xJc zrk bgx 383837 666676;00095
mbc epk dxc hLt 632738 735664;00096
msm csf Lak nJn 842653 788267;00097
mpe chr mkb bba 686645 863246;00098
cbr eex kra ffm 464856 667343;00099
tLr gLL gbp gaf 572664 254672;00100
xJt Jxc dks pfa 664433 445354;00101
Lrn cac bps mtJ 744576 367758;00102
hgh Jgx tkn gef 574544 283282;00103
hdf kdz ntJ rnr 337476 723368;00104
azf eze tge Jtx 788866 227234;00105
sph tpe rkm aax 257226 344277;00106
zJz bee rfh mbz 735787 572263;00107
dbb has ces nan 647342 876863;00108
ftm zac fza rdh 432487 678447;00109
saJ ftr har pzb 248576 753728;00110
Jzg Lee tfg nah 335624 687542;00111
Lcb mLL LdJ rLn 837553 354776;00112
dJJ fnx azn hre 838762 678534;00113
aft xcr ffg ttn 486334 682848;00114
tan ted txx ztr 624744 647383;00115
hfc bnz nbf rdg 564624 257647;00116
hkm tmL msz age 288835 623358;00117
mrt tna Jha Jhe 456868 457865;00118
ggh hme tkc btr 434336 862837;00119
kJh mzr Lsk snt 484286 783372;00120
hne xem kma Jsn 722622 648357;00121
rhx czh xkd htp 746683 762627;00122
mJx pfL tmr tae 388263 556384;00123
bpJ rtg kJb grp 633574 472265;00124
tex ntk rkJ xnx 643356 326626;00125
bpg acp pJp nzt 287282 385554;00126
Lpd zap adm bbn 448267 746726;00127
gpp gkt trk xLL 322764 836665;00128
cpp sxe rtt kts 373678 567367;00129
rzp fca chf Lgg 872555 484652;00130
zxk tpc pzm bxz 352423 678822;00131
gfn Lsa dLf bzx 668586 253446;00132
JJh raf egc fgm 346236 456574;00133
rhe pbd gdz rfb 377785 225672;00134
gJh dek drn ecz 485262 525485;00135
znx bzx cdt zLf 485587 774836;00136
Jmx nzh Lme tre 257243 578576;00137
rJh azf kdJ sLJ 886568 246286;00138
dds fth Jap acJ 755576 362432;00139
pmz Jgh ded tna 763488 483256;00140
nph fzr nLb ned 728388 352587;00141
hxz Jhk rer ska 745677 246584;00142
dcz ptt nat sdz 733564 333538;00143
erk tch fpa rtd 576435 477582;00144
gtg dbx hLx erm 642537 566383;00145
rJk ztz xks chs 865448 636676;00146
fmh cLL rgt fns 756223 564637;00147
tJn xnc zzs dpp 733875 667864;00148
zte fxb adx fpJ 665372 555865;00149
aht has zcp kan 864583 848322;00150
taf Lrp hzg nsk 467634 853473;00151
crx gbz arm fez 722745 556383;00152
krd pmm ztn Lmm 464477 585257;00153
tzk nJa cdn rLL 385553 866536;00154
cfL pez kfs beh 532482 543472;00155
pag dnt smn hss 432323 253373;00156
crb meb zxL tLz 722662 638457;00157
npb zzx thn drr 668536 788482;00158
pee xdb knt pac 667834 288656;00159
bLe Lax sab hcJ 328645 228544;00160
gzb pbe hJz rpf 252325 634727;00161
nrm enr Lpn LtJ 755375 752553;00162
mgk ptp Lax bht 835867 566484;00163
mJg abJ tzk mct 847485 844577;00164
gak fhJ dLt cns 886473 358734;00165
Jtm fmm fts zgg 545352 658758;00166
kzn mpp pbe mgd 884665 856773;00167
Jnx arc xkf sJc 377835 456288;00168
ggp JfJ gse dfs 528834 643254;00169
aec nsf gkx kJL 237767 677286;00170
cft Jka tex arm 865283 372464;00171
psr ftm dgs mdn 726737 247444;00172
Jpe hxp rda rkr 787243 645423;00173
dLa aft eLd hpa 284725 355757;00174
mrm pxh crs fLs 475875 873822;00175
khL arf cpb ped 582873 854658;00176
zhn mJx xzr amn 724448 822832;00177
kss kgn tgf rpe 837537 724455;00178
ads nfa Lcn xhb 683427 654662;00179
mrb tJJ rcs fkL 372442 735435;00180
gfp dsn bLn Lds 878565 642432;00181
cmL Lpx tkp nzc 828336 874643;00182
scc fLL Lbh acp 433878 325233;00183
mtr aLg str ttL 268425 464884;00184
zkx bch Jab xhf 688366 487845;00185
amm ppn tpk feh 342825 346837;00186
axf Jed gbs Jfb 535775 277388;00187
LkL heg ezb Ltn 722443 545243;00188
dex Jra car dpe 357283 282743;00189
Jzk rkk zsg exJ 855825 882253;00190
dzg rmc bpr cpp 274877 385442;00191
hze rrb tzL hnd 724723 335788;00192
zer sLc phn nLh 878882 432688;00193
cmr znh nLf tsk 554682 833775;00194
Lrt krJ zrJ pbz 455852 655475;00195
ztf hmg kdL fbk 583635 272375;00196
mpg Lmg esf ekc 337427 368753;00197
pgt hge fgc egm 566348 678585;00198
szc nsz kgm akr 536537 574624;00199
